{
  "kind": "cineweave_codex_color_pipeline_profile",
  "contractVersion": "2.5.0",
  "colorPipelineProfileId": "color-pipeline.rain-courtyard-v1",
  "version": 1,
  "worldId": "world-cloud-dynasty",
  "skillReceipt": {
    "repository": "https://github.com/owner/repository",
    "ref": "v2.5.1",
    "commit": "0123456789abcdef0123456789abcdef01234567",
    "contentHash": "sha256:aaaaaaaaaaaaaaaaaaaaaaaaaaaaaaaaaaaaaaaaaaaaaaaaaaaaaaaaaaaaaaaa",
    "installedBy": "codex-environment",
    "usedAt": "2026-09-02T08:00:00.000Z"
  },
  "profileStatus": "planned",
  "ocioConfig": {
    "configId": "ocio-config.project-aces",
    "configVersion": "2.3.0",
    "contentHash": "sha256:eeeeeeeeeeeeeeeeeeeeeeeeeeeeeeeeeeeeeeeeeeeeeeeeeeeeeeeeeeeeeeee",
    "configSource": "project_registry",
    "referenceSpaceModel": "ocio-scene-and-display-reference",
    "loadStatus": "not_loaded"
  },
  "sourceMedia": [
    {
      "bindingId": "color-source.cloud-palace-take-001",
      "mediaImportRef": {
        "kind": "cineweave_codex_media_import",
        "id": "media-import.cloud-palace-scene-01-shot-04-take-001",
        "version": 1,
        "contentHash": "sha256:ffffffffffffffffffffffffffffffffffffffffffffffffffffffffffffffff"
      },
      "mediaId": "media-cloud-palace-take-001",
      "inputColorSpace": {
        "name": "ACEScct",
        "assignmentStatus": "declared",
        "basis": "manual_review"
      },
      "metadata": {
        "status": "declared",
        "primaries": "AP1",
        "transfer": "ACEScct",
        "matrix": "rgb",
        "range": "full"
      }
    }
  ],
  "referenceSpacePolicy": {
    "sceneReferenceSpace": "scene_referred",
    "displayReferenceSpace": "display_referred",
    "workingColorSpace": "ACEScg",
    "workingRole": "scene_linear"
  },
  "outputTargets": [
    {
      "targetId": "color-output.preview-srgb",
      "purpose": "preview",
      "display": "sRGB",
      "view": "ACES SDR Video",
      "outputColorSpace": "sRGB",
      "path": {
        "mode": "view_transform_and_display_colorspace",
        "viewTransform": "ACES SDR Video",
        "displayColorSpace": "sRGB"
      }
    },
    {
      "targetId": "color-output.delivery-rec709",
      "purpose": "delivery",
      "display": "Rec.709 SDR Master",
      "view": "ACES Rec.709 Video",
      "outputColorSpace": "Rec.709",
      "path": {
        "mode": "view_transform_and_display_colorspace",
        "viewTransform": "ACES Rec.709 Video",
        "displayColorSpace": "Rec.709"
      }
    }
  ],
  "creativeLookPolicy": {
    "appliesCreativeLook": false,
    "creativeLookTransformNames": [],
    "ownerBoundary": "style-intent-separate"
  },
  "executionBoundary": {
    "providerNeutral": true,
    "loadsOcioConfig": false,
    "appliesColorTransforms": false,
    "writesMedia": false,
    "exportsLut": false,
    "humanApprovalRequired": true,
    "notes": "This is an immutable plan. A separately approved Production adapter must load the exact config and apply any transform."
  },
  "validation": {
    "configIdentityExact": true,
    "sourceBindingsExact": true,
    "metadataHonest": true,
    "referenceSpacesSeparated": true,
    "outputPathsDeclared": true,
    "previewDeliverySeparated": true,
    "providerNeutral": true
  },
  "provenance": {
    "source": "suite_builtin",
    "createdAt": "2026-09-02T08:00:00.000Z",
    "updatedAt": "2026-09-02T08:00:00.000Z",
    "changeLog": [
      "Created a planned OCIO-model-aligned color pipeline without loading a config or changing media.",
      "Separated declared source metadata, scene working space, preview path and delivery path."
    ]
  }
}
